{
  "id": "deliv-001-logo-final",
  "taskId": "task-001-design-logo",
  "contractId": "contr-001-sarah-logo",
  "submitter": {
    "id": "human-sarah-chen",
    "name": "Sarah Chen"
  },
  "artifacts": [
    {
      "type": "file",
      "reference": "https://storage.example.com/nexabridge-logo-package.zip",
      "description": "Complete logo package including SVG, PNG, PDF formats in multiple sizes",
      "checksum": "a7ffc6f8bf1ed76651c14756a061d662f580ff4de43b49fa82d80a4b80f8434a",
      "mimeType": "application/zip",
      "size": 2458624
    },
    {
      "type": "document",
      "reference": "https://storage.example.com/logo-usage-guidelines.pdf",
      "description": "Logo usage guidelines and brand applications",
      "mimeType": "application/pdf",
      "size": 1024000
    },
    {
      "type": "file",
      "reference": "https://storage.example.com/source-files.ai",
      "description": "Adobe Illustrator source file",
      "mimeType": "application/illustrator",
      "size": 3145728
    }
  ],
  "evidence": {
    "items": [
      {
        "type": "worklog",
        "reference": "https://storage.example.com/design-process-log.md",
        "description": "Daily work log with time tracking and design decisions",
        "timestamp": "2026-02-18T16:45:00Z"
      },
      {
        "type": "screenshot",
        "reference": "https://storage.example.com/process-sketches.png",
        "description": "Initial concept sketches and iteration process",
        "timestamp": "2026-02-10T18:30:00Z"
      },
      {
        "type": "citation",
        "reference": "https://storage.example.com/inspiration-sources.md",
        "description": "Documented inspiration sources with proper attribution",
        "timestamp": "2026-02-09T10:00:00Z"
      }
    ],
    "provenance": {
      "sources": [
        {
          "type": "AI Tool",
          "reference": "Midjourney v6 - used for initial concept exploration only",
          "accessed": "2026-02-08T14:00:00Z"
        },
        {
          "type": "Reference",
          "reference": "Geometric Design Principles by Josef MÃ¼ller-Brockmann",
          "accessed": "2026-02-07T09:30:00Z"
        }
      ],
      "tools": [
        "Adobe Illustrator CC 2026",
        "Midjourney v6 (concept exploration)",
        "Figma (collaboration and feedback)"
      ],
      "contributors": [
        {
          "id": "agent-alpha-001",
          "role": "Feedback and iteration coordination"
        }
      ]
    }
  },
  "completionNotes": "Completed 2 days ahead of schedule. The final design blends a geometric 'bridge' motif with flowing, interconnected nodes representing human-AI collaboration. The color palette uses the requested tech blues with warm accent colors to emphasize human-centered values. All acceptance criteria met. Included bonus animated logo variant for digital use.",
  "acceptanceMet": [
    {
      "criteriaId": "crit-001",
      "status": "met",
      "notes": "Tested at sizes from 16px (favicon) to 2000px (billboard). Remains clear and recognizable."
    },
    {
      "criteriaId": "crit-002",
      "status": "met",
      "notes": "Provided icon-only, text-only, and combined horizontal/vertical lockups."
    },
    {
      "criteriaId": "crit-003",
      "status": "met",
      "notes": "Included full-color, monochrome, and reversed (white on dark) versions."
    },
    {
      "criteriaId": "crit-004",
      "status": "met",
      "notes": "Design rationale document explains how bridge motif represents innovation and connection."
    }
  ],
  "submittedAt": "2026-02-18T17:00:00Z",
  "status": "submitted"
}
